{
  "$schema": "https://ui.shadcn.com/schema/registry-item.json",
  "name": "data-workspace",
  "type": "registry:block",
  "title": "Data workspace",
  "description": "Collection sidebar (TreeView) + FilterBar + Table + StatCards + Pagination.",
  "dependencies": [
    "react"
  ],
  "registryDependencies": [
    "auraglass"
  ],
  "files": [
    {
      "path": "index.tsx",
      "type": "registry:block"
    },
    {
      "path": "fixtures.ts",
      "type": "registry:item"
    }
  ],
  "meta": {
    "auraglass": {
      "owner": "SURF",
      "surface": "block",
      "client": true,
      "components": [
        "FilterBar",
        "Pagination",
        "StatCard",
        "Table",
        "TreeView"
      ],
      "ga": true,
      "minVersion": "5.0.0"
    }
  }
}
