{
  "$schema": "https://ui.shadcn.com/schema/registry-item.json",
  "name": "account-menu",
  "type": "registry:item",
  "title": "Account Menu",
  "description": "Menu composition replacing 4.x HeaderUserMenu: avatar trigger, labelled account group, destructive sign-out.",
  "dependencies": ["aura-glass"],
  "files": [
    {
      "path": "index.tsx",
      "type": "registry:item",
      "target": "components/account-menu.tsx"
    }
  ],
  "meta": {
    "auraglass": {
      "owner": "CMP",
      "surface": "item",
      "client": true,
      "components": [
        "Avatar",
        "Menu"
      ],
      "ga": true,
      "minVersion": "5.0.0"
    }
  }
}
