{
  "$schema": "https://ui.shadcn.com/schema/registry-item.json",
  "name": "analytics-dashboard",
  "type": "registry:block",
  "title": "Analytics dashboard",
  "description": "StatCard row + Sparkline + ChartFrame + Timeline.",
  "dependencies": [
    "react"
  ],
  "registryDependencies": [
    "auraglass"
  ],
  "files": [
    {
      "path": "index.tsx",
      "type": "registry:block"
    },
    {
      "path": "fixtures.ts",
      "type": "registry:item"
    }
  ],
  "meta": {
    "auraglass": {
      "owner": "SURF",
      "surface": "block",
      "client": false,
      "components": [
        "ChartFrame",
        "Sparkline",
        "StatCard",
        "Timeline"
      ],
      "ga": true,
      "minVersion": "5.0.0",
      "certified": null
    }
  }
}
