{
  "$schema": "https://ui.shadcn.com/schema/registry-item.json",
  "name": "faceted-search",
  "type": "registry:item",
  "title": "Faceted search",
  "description": "FilterBar facet panel + result list.",
  "dependencies": ["react"],
  "registryDependencies": [],
  "files": [
    { "path": "index.tsx", "type": "registry:item" },
    { "path": "fixtures.ts", "type": "registry:item" }
  ]
}
