{
  "$schema": "https://ui.shadcn.com/schema/registry-item.json",
  "name": "diff-viewer",
  "type": "registry:item",
  "title": "Diff viewer",
  "description": "Unified-diff table with add/del/context states and dual line numbering.",
  "dependencies": ["react", "aura-glass@^5"],
  "registryDependencies": ["auraglass"],
  "files": [
    { "path": "index.tsx", "type": "registry:item" },
    { "path": "fixtures.ts", "type": "registry:item" }
  ],
  "meta": {
    "auraglass": {
      "owner": "PLAT",
      "surface": "item",
      "client": true,
      "components": ["Badge", "Card", "Text"],
      "ga": true,
      "minVersion": "5.0.0",
      "certified": null,
      "replaces": []
    }
  }
}
